{
  "schema_version": 1,
  "struct_type": "grid",
  "meta": {
    "title": "子网划分：192.168.1.0/26 → 4 个子网",
    "caption": "C 类网络 192.168.1.0/24 借 2 位做子网号，划分为 4 个子网"
  },
  "rows": 1,
  "cols": 8,
  "col_labels": ["128", "64", "32", "16", "8", "4", "2", "1"],
  "presets": [
    {
      "name": "子网掩码与子网地址分解",
      "steps": [
        {
          "cells": [
            { "r": 0, "c": 0, "val": "1" }, { "r": 0, "c": 1, "val": "1" },
            { "r": 0, "c": 2, "val": "0" }, { "r": 0, "c": 3, "val": "0" },
            { "r": 0, "c": 4, "val": "0" }, { "r": 0, "c": 5, "val": "0" },
            { "r": 0, "c": 6, "val": "0" }, { "r": 0, "c": 7, "val": "0" }
          ],
          "hl": [
            { "r": 0, "c": 0, "kind": "mask" }, { "r": 0, "c": 1, "kind": "mask" }
          ],
          "title": "子网掩码 .11000000 = .192",
          "desc": "C 类 /24 借 2 位 → /26。掩码 `255.255.255.192`，最后字节 `.11000000`：前 2 位为子网号（蓝色），后 6 位为主机号"
        },
        {
          "cells": [
            { "r": 0, "c": 0, "val": "0" }, { "r": 0, "c": 1, "val": "0" },
            { "r": 0, "c": 2, "val": "0" }, { "r": 0, "c": 3, "val": "0" },
            { "r": 0, "c": 4, "val": "0" }, { "r": 0, "c": 5, "val": "0" },
            { "r": 0, "c": 6, "val": "0" }, { "r": 0, "c": 7, "val": "0" }
          ],
          "hl": [
            { "r": 0, "c": 0, "kind": "mask" }, { "r": 0, "c": 1, "kind": "mask" }
          ],
          "title": "子网 1：00 | 000000 = .0",
          "desc": "子网号 `00`。子网地址 `192.168.1.0/26`，可用 IP：.1～.62，广播地址 .63"
        },
        {
          "cells": [
            { "r": 0, "c": 0, "val": "0" }, { "r": 0, "c": 1, "val": "1" },
            { "r": 0, "c": 2, "val": "0" }, { "r": 0, "c": 3, "val": "0" },
            { "r": 0, "c": 4, "val": "0" }, { "r": 0, "c": 5, "val": "0" },
            { "r": 0, "c": 6, "val": "0" }, { "r": 0, "c": 7, "val": "0" }
          ],
          "hl": [
            { "r": 0, "c": 0, "kind": "mask" }, { "r": 0, "c": 1, "kind": "mask" }
          ],
          "title": "子网 2：01 | 000000 = .64",
          "desc": "子网号 `01`。子网地址 `192.168.1.64/26`，可用 IP：.65～.126，广播地址 .127"
        },
        {
          "cells": [
            { "r": 0, "c": 0, "val": "1" }, { "r": 0, "c": 1, "val": "0" },
            { "r": 0, "c": 2, "val": "0" }, { "r": 0, "c": 3, "val": "0" },
            { "r": 0, "c": 4, "val": "0" }, { "r": 0, "c": 5, "val": "0" },
            { "r": 0, "c": 6, "val": "0" }, { "r": 0, "c": 7, "val": "0" }
          ],
          "hl": [
            { "r": 0, "c": 0, "kind": "mask" }, { "r": 0, "c": 1, "kind": "mask" }
          ],
          "title": "子网 3：10 | 000000 = .128",
          "desc": "子网号 `10`。子网地址 `192.168.1.128/26`，可用 IP：.129～.190，广播地址 .191"
        },
        {
          "cells": [
            { "r": 0, "c": 0, "val": "1" }, { "r": 0, "c": 1, "val": "1" },
            { "r": 0, "c": 2, "val": "0" }, { "r": 0, "c": 3, "val": "0" },
            { "r": 0, "c": 4, "val": "0" }, { "r": 0, "c": 5, "val": "0" },
            { "r": 0, "c": 6, "val": "0" }, { "r": 0, "c": 7, "val": "0" }
          ],
          "hl": [
            { "r": 0, "c": 0, "kind": "mask" }, { "r": 0, "c": 1, "kind": "mask" }
          ],
          "title": "子网 4：11 | 000000 = .192",
          "desc": "子网号 `11`。子网地址 `192.168.1.192/26`，可用 IP：.193～.254，广播地址 .255。4 个子网各 62 台主机（`2^6-2`）"
        }
      ]
    }
  ]
}
